{
  "groups": [
    {
      "cases": [
        {
          "details": {
            "observed": {
              "Feb": "100",
              "Jan": "80"
            },
            "unit": "千件"
          },
          "evidence_ids": [
            "chart-base.svg",
            "csv:e865ff6b4e34481c40fca7b8f9af558f606fef7099e829b79e93db3061f1fb43"
          ],
          "id": "chart-base",
          "reasons": [
            "(100-80)/80*100=25.00"
          ],
          "security_violation": false,
          "status": "answer",
          "value": "25"
        },
        {
          "details": {
            "observed": {
              "Feb": "100",
              "Jan": "80"
            },
            "unit": "千件"
          },
          "evidence_ids": [
            "chart-truncated-axis.svg",
            "csv:e865ff6b4e34481c40fca7b8f9af558f606fef7099e829b79e93db3061f1fb43"
          ],
          "id": "chart-truncated",
          "reasons": [
            "(100-80)/80*100=25.00"
          ],
          "security_violation": false,
          "status": "answer",
          "value": "25"
        },
        {
          "details": {},
          "evidence_ids": [
            "chart-missing-unit.svg",
            "csv:e865ff6b4e34481c40fca7b8f9af558f606fef7099e829b79e93db3061f1fb43"
          ],
          "id": "chart-missing-unit",
          "reasons": [
            "svg:missing-unit"
          ],
          "security_violation": false,
          "status": "unknown",
          "value": null
        }
      ],
      "id": 1,
      "title": "图表读数：形状、基线与单位"
    },
    {
      "cases": [
        {
          "details": {
            "axis_origin": "70",
            "visible_heights": [
              "10",
              "30"
            ]
          },
          "evidence_ids": [
            "chart-truncated-axis.svg",
            "csv:e865ff6b4e34481c40fca7b8f9af558f606fef7099e829b79e93db3061f1fb43"
          ],
          "id": "chart-truncated-crosscheck",
          "reasons": [
            "(100-80)/80*100=25.00"
          ],
          "security_violation": false,
          "status": "answer",
          "value": "25"
        },
        {
          "details": {},
          "evidence_ids": [
            "chart-base.svg",
            "csv:8b810e1abe3692df8039d91f274c0f268a7ba7e569549c52252f438de5350ac1"
          ],
          "id": "csv-conflict",
          "reasons": [
            "chart-csv-conflict"
          ],
          "security_violation": false,
          "status": "unknown",
          "value": null
        },
        {
          "details": {},
          "evidence_ids": [
            "chart-base.svg",
            "csv:b6200c1516bda1cb0fa32d5207221289d22a5c9d14db441469b3f99744e57f42"
          ],
          "id": "csv-duplicate",
          "reasons": [
            "csv-columns-or-row-count"
          ],
          "security_violation": false,
          "status": "unknown",
          "value": null
        },
        {
          "details": {},
          "evidence_ids": [
            "chart-base.svg",
            "csv:ce7929bdbcdc48cbccd8b4e689dd0dafcb2d8aab86468d07d9c7bde03f755a1e"
          ],
          "id": "csv-bom",
          "reasons": [
            "(100-80)/80*100=25.00"
          ],
          "security_violation": false,
          "status": "answer",
          "value": "25"
        },
        {
          "details": {},
          "evidence_ids": [
            "chart-missing-tick.svg",
            "csv:e865ff6b4e34481c40fca7b8f9af558f606fef7099e829b79e93db3061f1fb43"
          ],
          "id": "chart-missing-tick",
          "reasons": [
            "svg:incomplete-or-ambiguous-plot"
          ],
          "security_violation": false,
          "status": "unknown",
          "value": null
        },
        {
          "details": {},
          "evidence_ids": [
            "chart-double-legend.svg",
            "csv:e865ff6b4e34481c40fca7b8f9af558f606fef7099e829b79e93db3061f1fb43"
          ],
          "id": "chart-double-legend",
          "reasons": [
            "svg:ambiguous-legend"
          ],
          "security_violation": false,
          "status": "unknown",
          "value": null
        },
        {
          "details": {},
          "evidence_ids": [
            "chart-missing-unit.svg",
            "csv:e865ff6b4e34481c40fca7b8f9af558f606fef7099e829b79e93db3061f1fb43"
          ],
          "id": "chart-missing-unit-crosscheck",
          "reasons": [
            "svg:missing-unit"
          ],
          "security_violation": false,
          "status": "unknown",
          "value": null
        },
        {
          "details": {},
          "evidence_ids": [
            "chart-zero.svg",
            "csv:17502d2db7348548359e404a5f0f58bf712dd5acc2db1671d7a5fb2ceb2ec460"
          ],
          "id": "chart-zero-denominator",
          "reasons": [
            "zero-denominator"
          ],
          "security_violation": false,
          "status": "unknown",
          "value": null
        }
      ],
      "id": 2,
      "title": "独立数据核验：冲突不是答案"
    },
    {
      "cases": [
        {
          "details": {
            "display_xy": [
              800,
              450
            ],
            "executed": true,
            "frame_id": "f1",
            "post_frame_id": "f2",
            "reasons": [
              "post-state-observed"
            ],
            "status": "verified"
          },
          "evidence_ids": [
            "screen:synthetic",
            "policy:fixed-v1"
          ],
          "id": "screen-verified",
          "reasons": [
            "post-state-observed"
          ],
          "security_violation": false,
          "status": "answer",
          "value": "submitted=true"
        },
        {
          "details": {
            "display_xy": null,
            "executed": false,
            "frame_id": "f1",
            "post_frame_id": null,
            "reasons": [
              "frame-stale-or-future"
            ],
            "status": "refresh"
          },
          "evidence_ids": [
            "screen:synthetic",
            "policy:fixed-v1"
          ],
          "id": "screen-stale",
          "reasons": [
            "frame-stale-or-future"
          ],
          "security_violation": false,
          "status": "refresh",
          "value": null
        },
        {
          "details": {
            "display_xy": null,
            "executed": false,
            "frame_id": "f1",
            "post_frame_id": null,
            "reasons": [
              "action-not-authorized"
            ],
            "status": "blocked"
          },
          "evidence_ids": [
            "screen:synthetic",
            "policy:fixed-v1"
          ],
          "id": "screen-unapproved",
          "reasons": [
            "action-not-authorized"
          ],
          "security_violation": false,
          "status": "blocked",
          "value": null
        },
        {
          "details": {
            "display_xy": [
              800,
              450
            ],
            "executed": true,
            "frame_id": "f1",
            "post_frame_id": null,
            "reasons": [
              "no-post-frame"
            ],
            "status": "unknown"
          },
          "evidence_ids": [
            "screen:synthetic",
            "policy:fixed-v1"
          ],
          "id": "screen-no-post",
          "reasons": [
            "no-post-frame"
          ],
          "security_violation": false,
          "status": "unknown",
          "value": null
        }
      ],
      "id": 3,
      "title": "屏幕操作：帧、授权与后验"
    },
    {
      "cases": [
        {
          "details": {
            "backend_task": "running",
            "committed_actions": [],
            "conversation_tail": "removed",
            "event_source": "voice-interruption.json",
            "generation": "cancelled",
            "issues": [],
            "playback": "stopped"
          },
          "evidence_ids": [
            "voice:interruption-events"
          ],
          "id": "voice-interruption",
          "reasons": [],
          "security_violation": false,
          "status": "answer",
          "value": "playback-stopped/backend-running"
        },
        {
          "details": {
            "backend_task": "cancelled",
            "committed_actions": [],
            "conversation_tail": "present",
            "event_source": "voice-task-cancel.json",
            "generation": "unknown",
            "issues": [],
            "playback": "idle"
          },
          "evidence_ids": [
            "voice:cancel-events"
          ],
          "id": "voice-task-cancel",
          "reasons": [],
          "security_violation": false,
          "status": "answer",
          "value": "backend-cancelled"
        },
        {
          "details": {
            "backend_task": "unknown",
            "committed_actions": [],
            "conversation_tail": "present",
            "event_source": "voice-conflict.json",
            "generation": "unknown",
            "issues": [
              "conflicting-duplicate-sequence"
            ],
            "playback": "idle"
          },
          "evidence_ids": [
            "voice:conflict-events"
          ],
          "id": "voice-conflict",
          "reasons": [
            "conflicting-duplicate-sequence"
          ],
          "security_violation": false,
          "status": "unknown",
          "value": null
        }
      ],
      "id": 4,
      "title": "语音事件：打断、停播与任务状态"
    },
    {
      "cases": [
        {
          "details": {},
          "evidence_ids": [
            "chart-base.svg",
            "csv:e865ff6b4e34481c40fca7b8f9af558f606fef7099e829b79e93db3061f1fb43"
          ],
          "id": "integrated-evidence",
          "reasons": [
            "(100-80)/80*100=25.00"
          ],
          "security_violation": false,
          "status": "answer",
          "value": "25"
        },
        {